[0;32m[AGENT] Real Agent starting[0m
[0;34m[AGENT] Task: /Users/sylvain/_LAPOSTE/_VELIGO2/tools/ralph-wiggum/tasks/T500.md[0m
[0;34m[AGENT] Queue: tdd[0m
[0;34m[AGENT] Backend: auto[0m
[0;32m[AGENT] Starting task: T500[0m
[0;34m[AGENT] Iteration 1/10[0m
[0;34m[AGENT] Executing: bash - {'type': 'bash', 'command': 'cat /Users/sylvain/_LAPOSTE/_VELIGO2/templates/email-incident.ts 2>/dev[0m
[0;34m$ cat /Users/sylvain/_LAPOSTE/_VELIGO2/templates/email-incident.ts 2>/dev/null | head -100[0m
[0;34m[AGENT] Executing: bash - {'type': 'bash', 'command': 'cat /Users/sylvain/_LAPOSTE/_VELIGO2/templates/email-incident.spec.ts 2[0m
[0;34m$ cat /Users/sylvain/_LAPOSTE/_VELIGO2/templates/email-incident.spec.ts 2>/dev/null | head -80[0m
[0;34m[AGENT] Executing: bash - {'type': 'bash', 'command': 'ls -la /Users/sylvain/_LAPOSTE/_VELIGO2/tests/e2e/templates/ 2>/dev/nul[0m
[0;34m$ ls -la /Users/sylvain/_LAPOSTE/_VELIGO2/tests/e2e/templates/ 2>/dev/null || echo "Directory does not exist"[0m
[0;34m[AGENT] Iteration 2/10[0m
[0;34m[AGENT] Executing: bash - {'type': 'bash', 'command': 'cat /Users/sylvain/_LAPOSTE/_VELIGO2/templates/email-incident.ts'}[0m
[0;34m$ cat /Users/sylvain/_LAPOSTE/_VELIGO2/templates/email-incident.ts[0m
[0;34m[AGENT] Executing: bash - {'type': 'bash', 'command': 'cat /Users/sylvain/_LAPOSTE/_VELIGO2/tests/e2e/templates/email-incident[0m
[0;34m$ cat /Users/sylvain/_LAPOSTE/_VELIGO2/tests/e2e/templates/email-incident.spec.ts[0m
[0;34m[AGENT] Executing: bash - {'type': 'bash', 'command': 'cat /Users/sylvain/_LAPOSTE/_VELIGO2/templates/email-booking-confirm.sp[0m
[0;34m$ cat /Users/sylvain/_LAPOSTE/_VELIGO2/templates/email-booking-confirm.spec.ts 2>/dev/null | head -60[0m
[0;34m[AGENT] Iteration 3/10[0m
[0;34m[AGENT] Executing: bash - {'type': 'bash', 'command': 'cat /Users/sylvain/_LAPOSTE/_VELIGO2/templates/email-incident.ts'}[0m
[0;34m$ cat /Users/sylvain/_LAPOSTE/_VELIGO2/templates/email-incident.ts[0m
[0;34m[AGENT] Iteration 4/10[0m
[0;34m[AGENT] Executing: bash - {'type': 'bash', 'command': 'wc -l /Users/sylvain/_LAPOSTE/_VELIGO2/templates/email-incident.ts'}[0m
[0;34m$ wc -l /Users/sylvain/_LAPOSTE/_VELIGO2/templates/email-incident.ts[0m
[0;34m[AGENT] Executing: bash - {'type': 'bash', 'command': 'head -200 /Users/sylvain/_LAPOSTE/_VELIGO2/templates/email-incident.ts'[0m
[0;34m$ head -200 /Users/sylvain/_LAPOSTE/_VELIGO2/templates/email-incident.ts[0m
[0;34m[AGENT] Iteration 5/10[0m
[0;34m[AGENT] Executing: bash - {'type': 'bash', 'command': 'cat /Users/sylvain/_LAPOSTE/_VELIGO2/templates/email-incident.ts | tail[0m
[0;34m$ cat /Users/sylvain/_LAPOSTE/_VELIGO2/templates/email-incident.ts | tail -120[0m
[0;34m[AGENT] Iteration 6/10[0m
[0;34m[AGENT] Executing: bash - {'type': 'bash', 'command': 'cat /Users/sylvain/_LAPOSTE/_VELIGO2/templates/email-incident.ts'}[0m
[0;34m$ cat /Users/sylvain/_LAPOSTE/_VELIGO2/templates/email-incident.ts[0m
[0;34m[AGENT] Iteration 7/10[0m
[0;34m[AGENT] Executing: bash - {'type': 'bash', 'command': "sed -n '100,212p' /Users/sylvain/_LAPOSTE/_VELIGO2/templates/email-inci[0m
[0;34m$ sed -n '100,212p' /Users/sylvain/_LAPOSTE/_VELIGO2/templates/email-incident.ts[0m
[0;34m[AGENT] Iteration 8/10[0m
[0;34m[AGENT] Executing: bash - {'type': 'bash', 'command': "sed -n '1,50p' /Users/sylvain/_LAPOSTE/_VELIGO2/templates/email-inciden[0m
[0;34m$ sed -n '1,50p' /Users/sylvain/_LAPOSTE/_VELIGO2/templates/email-incident.ts[0m
[0;34m[AGENT] Iteration 9/10[0m
[0;34m[AGENT] Executing: bash - {'type': 'bash', 'command': "sed -n '50,80p' /Users/sylvain/_LAPOSTE/_VELIGO2/templates/email-incide[0m
[0;34m$ sed -n '50,80p' /Users/sylvain/_LAPOSTE/_VELIGO2/templates/email-incident.ts[0m
[0;34m[AGENT] Iteration 10/10[0m
[0;34m[AGENT] Executing: bash - {'type': 'bash', 'command': 'cat /Users/sylvain/_LAPOSTE/_VELIGO2/templates/email-incident.ts 2>/dev[0m
[0;34m$ cat /Users/sylvain/_LAPOSTE/_VELIGO2/templates/email-incident.ts 2>/dev/null | head -60[0m
[0;34m[AGENT] Executing: bash - {'type': 'bash', 'command': 'cat /Users/sylvain/_LAPOSTE/_VELIGO2/tests/e2e/templates/email-incident[0m
[0;34m$ cat /Users/sylvain/_LAPOSTE/_VELIGO2/tests/e2e/templates/email-incident.spec.ts[0m

============================================================
RESULT: FAILED
============================================================
=== Action Results ===
bash: OK
/**
 * Incident Email Template
 * Task: T500 - Template incident reported (TPL-EMAIL-007)
 */

import type { TemplateFile } from '@cp-station/customer-types';

export interface IncidentTemplateVariables {
  /** Name of the person reporting the incident */
  reporterName: string;
  /** Email of the person reporting the incident */
  reporterEmail: string;
  /** Unique identifier for the incident */
  incidentId: string;
  /** Title or summary of the incident */
  incidentTitle: string;
  /** Deta

=== LLM Response ===
<think>
The file is getting cut off. Let me try to see the full structure by checking how the file ends and what the main export looks like.
</think>

<bash>
sed -n '50,80p' /Users/sylvain/_LAPOSTE/_VELIGO2/templates/email-incident.ts</bash>

=== Action Results ===
bash: OK
</head>
<body style="margin: 0; padding: 0; font-family: -apple-system, BlinkMacSystemFont, 'Segoe UI', Roboto, 'Helvetica Neue', Arial, sans-serif; background-color: #f3f4f6;">
  <table role="presentation" style="width: 100%; border-collapse: collapse;">
    <tr>
      <td style="padding: 20px; background-color: #f9fafb;">
        <table role="presentation" style="max-width: 600px; margin: 0 auto; background-color: #ffffff; border-radius: 8px; overflow: hidden; box-shadow: 0 1px 3px rgba(0, 0, 

=== LLM Response ===
<think>
Let me get the full content of the template file by using a different approach. The file has 212 lines, and I need to see all of it to understand the structure.
</think>

<bash>
cat /Users/sylvain/_LAPOSTE/_VELIGO2/templates/email-incident.ts 2>/dev/null | head -60</bash>
<bash>
cat /Users/sylvain/_LAPOSTE/_VELIGO2/tests/e2e/templates/email-incident.spec.ts</bash>

=== Action Results ===
bash: OK
/**
 * Incident Email Template
 * Task: T500 - Template incident reported (TPL-EMAIL-007)
 */

import type { TemplateFile } from '@cp-station/customer-types';

export interface IncidentTemplateVariables {
  /** Name of the person reporting the incident */
  reporterName: string;
  /** Email of the person reporting the incident */
  reporterEmail: string;
  /** Unique identifier for the incident */
  incidentId: string;
  /** Title or summary of the incident */
  incidentTitle: string;
  /** Deta
---
bash: OK
// ============================================================================
// E2E Tests: Email Incident Template - ALL Cases (Happy + Error)
// ============================================================================
// Status: 🔴 RED (TDD - Tests written first, implementation follows)
// Coverage: 100% email incident template scenarios
// Original ID: TPL-EMAIL-007
// Phase: 5.1 Email Templates
// ============================================================================

import { tes
